ID,deck,front,back,tags,note_type,media,flag_reason
635,PMBOK6 - Core Terms,Why should project managers adjust their management style?,To align with the willingness and ability of team members,KA::Resource,Basic,,back_length_50_80_consider_cloze
636,PMBOK6 - Core Terms,What are common sources of conflict in projects?,"Scarce resources, scheduling priorities, personal work styles",KA::Resource,Basic,,back_length_50_80_consider_cloze
637,PMBOK6 - Core Terms,What are benefits of successfully managing conflict?,"Increased productivity, better decision making, improved relationships",KA::Resource,Basic,,back_length_50_80_consider_cloze
638,PMBOK6 - Core Terms,When should conflict be addressed and how?,"Early, in private, using a direct, collaborative approach",KA::Resource,Basic,,back_length_50_80_consider_cloze
644,PMBOK6 - Core Terms,What are some guidelines for effective decision making in resource management?,"Focus on goals, follow process, analyze info, consider risk",KA::Resource,Basic,,back_length_50_80_consider_cloze
646,PMBOK6 - Core Terms,Why is influencing critical in matrix project environments?,PMs lack authority; must gain cooperation and support,KA::Resource,Basic,,back_length_50_80_consider_cloze
649,PMBOK6 - Core Terms,What is the purpose of the Control Resources process?,To ensure physical resources are available as planned and used appropriately,KA::Resource PG::Monitoring,Basic,,back_length_50_80_consider_cloze
651,PMBOK6 - Core Terms,What types of resources are managed under the Control Resources process?,"Physical resources (equipment, materials, facilities, infrastructure)",KA::Resource PG::Monitoring,Basic,,back_length_50_80_consider_cloze
653,PMBOK6 - Core Terms,What are the steps involved in problem solving in resource control?,"Identify, Define, Investigate, Analyze, Solve, Check",KA::Resource PG::Monitoring,Basic,,back_length_50_80_consider_cloze
654,PMBOK6 - Core Terms,What are common forms communication can take on a project?,"Written, Spoken, Gestural, Media-based, Word choice",KA::Communication,Basic,,back_length_50_80_consider_cloze
656,PMBOK6 - Core Terms,Why is communication important in project management?,It bridges stakeholder differences and enhances understanding,KA::Communication,Basic,,back_length_50_80_consider_cloze
664,PMBOK6 - Core Terms,What does a multifaceted communication approach involve?,Using various technologies and respecting stakeholder preferences,KA::Communication,Basic,,back_length_50_80_consider_cloze
665,PMBOK6 - Core Terms,What tailoring considerations apply to communication technology?,"Availability, appropriateness, and cost-effectiveness",KA::Communication,Basic,,back_length_50_80_consider_cloze
666,PMBOK6 - Core Terms,How does Agile handle evolving communication needs?,"Frequent updates, transparency, stakeholder reviews",KA::Communication,Basic,,back_length_50_80_consider_cloze
668,PMBOK6 - Core Terms,What is the purpose of Plan Communications Management?,To develop an approach to project communications based on stakeholder needs.,KA::Communication PG::Planning,Basic,,back_length_50_80_consider_cloze
669,PMBOK6 - Core Terms,What is the key benefit of Plan Communications Management?,A documented plan to engage stakeholders with timely information.,KA::Communication PG::Planning,Basic,,back_length_50_80_consider_cloze
673,PMBOK6 - Core Terms,What are factors that affects the choice of communication technology?,"Urgency, reliability, ease, environment, or confidentiality.",KA::Communication PG::Planning,Basic,,back_length_50_80_consider_cloze
675,PMBOK6 - Core Terms,What is a communication model?,"A representation of the communication process (linear, interactive, complex).",KA::Communication PG::Planning,Basic,,back_length_50_80_consider_cloze
682,PMBOK6 - Core Terms,What can cause challenges in cross-cultural communication?,"Differences in language, styles, processes, and expectations.",KA::Communication PG::Planning,Basic,,back_length_50_80_consider_cloze
688,PMBOK6 - Core Terms,What is mass communication?,Minimal connection between sender and large audience.,KA::Communication PG::Planning,Basic,,back_length_50_80_consider_cloze
689,PMBOK6 - Core Terms,What is the purpose of a communication styles assessment?,"To determine stakeholder preferences for format, method, and content.",KA::Communication PG::Planning,Basic,,back_length_50_80_consider_cloze
718,PMBOK6 - Core Terms,Tailoring factors for Project Risk Management.,"Project size, project complexity, project importance, development approach.",KA::Risk,Basic,,back_length_50_80_consider_cloze
801,PMBOK6 - Core Terms,Escalate strategy for threats involves moving the risk to a higher organizational level. Why?,Because it's outside project scope or PM authority.,"KA::Risk,PG::Planning",Basic,,back_length_50_80_consider_cloze
836,PMBOK6 - Core Terms,What is the purpose of the Monitor Risks process?,"Track risks, evaluate risk process, and inform project decisions","KA::Risk,PG::Monitoring",Basic,,back_length_50_80_consider_cloze
841,PMBOK6 - Core Terms,What does reserve analysis determine during Monitor Risks?,If remaining reserve is adequate for remaining risk,"KA::Risk,PG::Monitoring",Basic,,back_length_50_80_consider_cloze
842,PMBOK6 - Core Terms,What are risk audits used for in Monitor Risks?,Evaluate the effectiveness of the risk management process,"KA::Risk,PG::Monitoring",Basic,,back_length_50_80_consider_cloze
886,PMBOK6 - Core Terms,What is the purpose of a make-or-buy analysis?,Determine whether to perform work in-house or purchase externally,KA::Procurement PG::Planning,Basic,,back_length_50_80_consider_cloze
894,PMBOK6 - Core Terms,What is the purpose of the Procurement Management Plan?,To define procurement activities and coordination with other project aspects.,KA::Procurement PG::Planning,Basic,,back_length_50_80_consider_cloze
900,PMBOK6 - Core Terms,What is the delivery method where the services provider acts as the buyer's representative?,Buyer/services provider acts as the representative,KA::Procurement PG::Planning,Basic,,back_length_50_80_consider_cloze
904,PMBOK6 - Core Terms,When are fixed-price contracts most suitable?,When work is predictable and requirements well-defined,KA::Procurement PG::Planning,Basic,,back_length_50_80_consider_cloze
909,PMBOK6 - Core Terms,What may be included in procurement phases?,"Sequencing, indicators, criteria, evaluation plan, knowledge transfer",KA::Procurement PG::Planning,Basic,,back_length_50_80_consider_cloze
938,PMBOK6 - Core Terms,What is the purpose of the Control Procurements process?,Ensure contract performance meets project requirements.,KA::Procurement PG::Monitoring,Basic,,back_length_50_80_consider_cloze
942,PMBOK6 - Core Terms,What are typical administrative activities in Control Procurements?,"Data collection, plan refinement, invoice management.",KA::Procurement PG::Monitoring,Basic,,back_length_50_80_consider_cloze
951,PMBOK6 - Core Terms,What are typical requirements for contract closure?,"All deliverables accepted, no claims, final payment.",KA::Procurement PG::Monitoring,Basic,,back_length_50_80_consider_cloze
985,PMBOK6 - Core Terms,What are common stakeholder classifications?,"Internal/external, power/interest, directions of influence",KA::Stakeholder PG::Initiating,Basic,,back_length_50_80_consider_cloze
995,PMBOK6 - Core Terms,What is the 'Leading' level of stakeholder engagement?,Aware and actively engaged in drive project success,KA::Stakeholder PG::Planning,Basic,,back_length_50_80_consider_cloze
